{
  "$schema": "../../../../schema/build-config.schema.json",
  "image": "ghcr.io/runlix/test-service",
  "version": "1.2.3",
  "defaults": {
    "context": "test-fixtures/ci/service",
    "test": "test-fixtures/ci/service/.ci/smoke-test.sh",
    "build_args": {
      "APP_VERSION": "1.2.3",
      "APP_PORT": "8080"
    }
  },
  "targets": [
    {
      "name": "stable-amd64",
      "manifest_tag": "1.2.3-stable",
      "platform": "linux/amd64",
      "dockerfile": "test-fixtures/ci/service/linux-amd64.Dockerfile",
      "build_args": {
        "BASE_REF": "gcr.io/distroless/base-debian12:latest-amd64@sha256:d2add786f2a5f43d1ab3ae54cd3193de929d0d12c378ff60891921f56f3e47ff",
        "VARIANT": "stable"
      }
    },
    {
      "name": "debug-amd64",
      "manifest_tag": "1.2.3-debug",
      "platform": "linux/amd64",
      "dockerfile": "test-fixtures/ci/service/linux-amd64.Dockerfile",
      "build_args": {
        "BASE_REF": "gcr.io/distroless/base-debian12:debug-amd64@sha256:d474201b07a626348745b2233f3ca83ed2c6c884d317bd7caa6642a15897ed03",
        "VARIANT": "debug"
      }
    }
  ]
}
