{
  "$schema": "../../schema/build-config.schema.json",
  "image": "ghcr.io/runlix/example-service",
  "version": "1.2.3",
  "defaults": {
    "test": ".ci/smoke-test.sh",
    "build_args": {
      "APP_PORT": "8080",
      "APP_VERSION": "1.2.3"
    }
  },
  "targets": [
    {
      "name": "stable-amd64",
      "manifest_tag": "1.2.3-stable",
      "platform": "linux/amd64",
      "dockerfile": "linux-amd64.Dockerfile",
      "build_args": {
        "BASE_REF": "ghcr.io/runlix/distroless-runtime:stable@sha256:507dec430a33f3fb5a9290d1d903f770fc11a78e4a12697bb899bd8a395014ac",
        "VARIANT": "stable"
      }
    },
    {
      "name": "debug-arm64",
      "manifest_tag": "1.2.3-debug",
      "platform": "linux/arm64",
      "dockerfile": "linux-arm64.Dockerfile",
      "build_args": {
        "BASE_REF": "ghcr.io/runlix/distroless-runtime:debug@sha256:f73e4f9f50d4898800ad7ce567150b1131f167318070b75e2ad5a1250c4c66cc",
        "VARIANT": "debug"
      }
    }
  ]
}
